title,description,source,date_of_publication,category,author,link
"Meet L. Louise Lucas, The 82-Year-Old Virginia Lawmaker Ruthlessly Trolling Republicans After Huge Election Win","Virginia State Sen. L. Louise Lucas is gaining national attention after Democrats secured a controversial redistricting victory that could reshape the state’s congressional map ahead of the midterms. Her viral moment was sparked by a celebratory video she posted on X, writing “THANK YOU VIRGINIA!” alongside a montage of herself dancing. The clip is set… Continue reading Meet L. Louise Lucas, The 82-Year-Old Virginia Lawmaker Ruthlessly Trolling Republicans After Huge Election Win",blavity.com,2026-04-30,Politics,Maya Boddie,https://blavity.com/virginia-lawmaker-trolls-republicans-after-election-win
"Trump’s Unprecedented Move To Put His Picture American Passports, Explained","President Donald Trump is yet again putting his personal brand on an official American institution. This time, the president’s image will appear on U.S. passports, a move that has never been done before in American history. In an unprecedented move, Trump’s face will appear on limited-edition U.S. passports The Bulwark first reported that two sources… Continue reading Trump’s Unprecedented Move To Put His Picture American Passports, Explained",blavity.com,2026-04-30,Politics,Christopher Rhodes,https://blavity.com/trumps-unprecedented-move-to-put-his-picture-american-passports-explained
This Bronx Founder’s Brand Co-Signed By Beyoncé And Rihanna Is Now Challenging Legacy Fashion Giants,"Sprayground is seeing significant growth in the resale market, outperforming legacy brands like Nike and Supreme in the accessories category on StockX with a reported +287% year-over-year increase. Behind that growth is founder David BenDavid, a Bronx-born designer whose creative foundation was shaped early. Growing up surrounded by art, music, and street culture, he describes… Continue reading This Bronx Founder’s Brand Co-Signed By Beyoncé And Rihanna Is Now Challenging Legacy Fashion Giants",blavity.com,2026-04-30,Culture,Trey Mangum,https://blavity.com/sprayground-bronx-founder-brand-cosigned-beyonce-rihanna
SC State Cancels MAGA-Supporting Lieutenant Governor As HBCU’s Commencement Speaker After Students Protest,Students protested after South Carolina State University chose South Carolina Lt. Gov. Pamela Evette to be commencement speaker.,blavity.com,2026-04-30,Politics,Christopher Rhodes,https://blavity.com/sc-state-cancels-pamela-evette-commencement-speaker-protest
How Roddy Ricch Broke Out Of ‘The Box’ And Earned An Eight-Figure Net Worth,"Roddy Ricch has earned a Grammy, two BET Awards and millions of streams from faithful listeners, culminating in a $20 million net worth.",blavity.com,2026-04-30,Entertainment,TeeJay Small,https://blavity.com/roddy-ricch-net-worth
Republicans Moving Quickly To Eliminate Majority-Black Congressional Districts After Supreme Court Guts Voting Rights Act,"The Supreme Court ruled to eliminate one of Louisiana’s two majority-Black districts, with the Court’s conservative majority placing severe limits on when and how race can be factored into districting processes. The ruling further weakens the Voting Rights Act of 1865. It also threatens to create a significant drop in Black representation in Congress as… Continue reading Republicans Moving Quickly To Eliminate Majority-Black Congressional Districts After Supreme Court Guts Voting Rights Act",blavity.com,2026-04-30,Politics,Christopher Rhodes,https://blavity.com/republicans-moving-to-eliminate-majority-black-districts-after-supreme-court-voting-rights-decision
Is Nair Safe? Expert Tips For Avoiding Burns And Hyperpigmentation,"Learn the ""must-know"" safety rules for using Nair, why timing is everything, and how to protect your skin barrier during hair removal.",blavity.com,2026-04-30,Health,"Dr. Diana Rangaves, PharmD",https://blavity.com/is-nair-safe
"La Toya Jackson, Brian Tyree Henry And Janelle James Revealed As ‘RuPaul’s Drag Race All Stars 11’ Guest Judges In Trailer","The first trailer for RuPaul’s Drag Race All Stars Season 11 has dropped, and the guest judge lineup includes Brian Tyree Henry, La Toya Jackson, Janelle James and more. Others include Bronwyn Newport, Christina Ricci, Cooper Koch, Evan Mulrooney, Gina Gershon, Juno Temple, Kate Hudson and Reneé Rapp, as well as regulars Jamal Sims and… Continue reading La Toya Jackson, Brian Tyree Henry And Janelle James Revealed As ‘RuPaul’s Drag Race All Stars 11’ Guest Judges In Trailer",blavity.com,2026-04-29,Entertainment,Trey Mangum,https://blavity.com/la-toya-jackson-brian-tyree-henry-drag-race-all-stars-trailer
Why Yung Miami’s Growing Net Worth Is A Win For Black Women In Media,Explore the growth of Yung Miami’s net worth in 2026 and how she’s redefining Black excellence in the podcasting and fashion industries.,blavity.com,2026-04-29,Entertainment,Sarah Rand,https://blavity.com/yung-miami-net-worth
HBCU Women Athletes Redefining Excellence in College Sports,"Profiles of standout HBCU women athletes, highlighting their careers, playing styles, and impact across college sports.",blavity.com,2026-04-29,Women,Arielle Poteau,https://blavity.com/hbcu-women-athletes
How Garlic And Honey Work Together To Boost Your Immunity,"From antimicrobial properties to lowering blood pressure, we’re breaking down the medicinal benefits of garlic and honey.",blavity.com,2026-04-29,Health,"Dr. Diana Rangaves, PharmD",https://blavity.com/garlic-and-honey-benefits
Tyler Adams Says The Game Is ‘Like A Chess Match’ As He Teams Up For ‘For The Assist’,"Tyler Adams said playing in the midfield requires constant awareness of everything happening on the pitch. “In our game, there are so many moving pieces — it’s almost like a chess match,” the U.S. Men’s National Team midfielder told Blavity in a recent interview. “You’re always trying to think ahead, understand your positioning, anticipate what’s… Continue reading Tyler Adams Says The Game Is ‘Like A Chess Match’ As He Teams Up For ‘For The Assist’",blavity.com,2026-04-28,Sports,Trey Mangum,https://blavity.com/tyler-adams-says-the-game-is-like-a-chess-match-as-he-teams-up-for-for-the-assist
Mamdani Launches NYC Office To Fight Deed Theft After City Council Member’s Viral Protest Arrest,New York City Mayor Zohran Mamdani announced the Office of Deed Theft Prevention to defend vulnerable homeowners.,blavity.com,2026-04-28,Politics,Christopher Rhodes,https://blavity.com/mamdani-launches-nyc-office-fight-deed-theft-after-protest-arrest
NBA Guard Jalen Green’s Net Worth Is A Case Study In Determination,"Explore Jalen Green's net worth and how the NBA star guard turned explosive scoring, contracts and endorsements into rising wealth.",blavity.com,2026-04-28,Culture,Joel Randell,https://blavity.com/jalen-green-net-worth
Sydney McLaughlin-Levrone On Self-Care And Healing As Athletes: ‘It’s A Never-Ending Cycle’,"Sydney McLaughlin-Levrone chats with Blavity about healing like a pro, self-care, daily motivations, and beyond.",blavity.com,2026-04-28,Sports,Shanique Yates,https://blavity.com/sydney-mclaughlin-on-self-care-healing
"Kwame Onwuachi On Why Food Access Still Matters, And How He’s Taking Action","Kwame Onwuachi has built a career rooted in storytelling, using food as a lens to explore culture, identity, and community. From his upbringing between the Bronx and Nigeria to his rise as a James Beard Award–winning chef and restaurateur, his work has consistently centered the idea that access to quality food should be a right,… Continue reading Kwame Onwuachi On Why Food Access Still Matters, And How He’s Taking Action",blavity.com,2026-04-28,News,Trey Mangum,https://blavity.com/kwame-onwuachi-on-why-food-access-still-matters
Marla Gibbs On ‘It’s Never Too Late’ Memoir And Why Spiritually She Identifies With Being In Her 30s,"Marla Gibbs chats with Blavity about her memoir ""It's Never Too Late,"" and why, spiritually, she resonates with being in her 30s.",blavity.com,2026-04-28,Books,Shanique Yates,https://blavity.com/marla-gibbs-reflects-on-memoir-its-never-too-late
"Maryland Is The First State To Ban Dynamic Pricing, Which Uses AI And Other Data To Up Prices At Stores","If consumers are wondering why they’re paying higher prices for certain items at major retailers and grocery stores, it might be due to “dynamic pricing,” a practice that uses artificial intelligence and other data to increase costs. Maryland legislators have passed a bill to become the first state to ban the practice. “And I can’t… Continue reading Maryland Is The First State To Ban Dynamic Pricing, Which Uses AI And Other Data To Up Prices At Stores",blavity.com,2026-04-28,Politics,Jahaura Michelle,https://blavity.com/maryland-is-the-first-state-to-ban-dynamic-pricing
‘ANTM’s Angelea Preston On Forgiveness And Forging Forward Amid E!’s ‘Dirty Rotten Scandals’ Episode,"There are several standouts from America’s Next Top Model, one of which is Angelea Preston. She was eliminated near the end of her original cycle before returning for the All-Stars and winning. Unfortunately, her title was stripped, initially without reason, after producers said they discovered she’d engaged in escorting services in her past. The blow… Continue reading ‘ANTM’s Angelea Preston On Forgiveness And Forging Forward Amid E!’s ‘Dirty Rotten Scandals’ Episode",blavity.com,2026-04-28,Entertainment,Brenda Alexander,https://blavity.com/antm-angelea-preston-on-forgiveness-and-forging-forward-dirty-rotten-scandals
‘Belle Collective: Birmingham’ Stars Explain What Sets Them Apart From the Jackson Belles,"Belle Collective: Birmingham is here. OWN’s newest franchise and first-ever Belle Collective spin-off, now airing Fridays at 8 p.m. on OWN. The spinoff is led by Love & Marriage: Huntsville alum Stormi Steele, the powerhouse behind the ever-growing Canvas Beauty brand, and she has some equally boss women in this collective. Amber Jones is Steele’s… Continue reading ‘Belle Collective: Birmingham’ Stars Explain What Sets Them Apart From the Jackson Belles",blavity.com,2026-04-28,Entertainment,Brenda Alexander,https://blavity.com/belle-collective-birmingham-stars-explain-what-sets-them-apart-from-the-jackson-belles
How To Find A Clinical Trial That Actually Prioritizes Your Safety,"Thinking about joining a clinical trial? From safety protocols to finding the right study, here is everything you need to know.",blavity.com,2026-04-28,Health,Joel Randell,https://blavity.com/clinical-trials
Chelley Bissainthe Of ‘Love Island USA’ Fame Teases New Show: ‘I’m A Lover Girl Through And Through’,"Chelley Bissainthe is stepping into a new role. On March 26 at Uproxx’s NewFront, she announced Love, Songs, an interview series she hosts and executive produces. The project places her both in front of the camera and in a creative role shaping the format. Bissainthe first gained national attention on Love Island USA Season 7.… Continue reading Chelley Bissainthe Of ‘Love Island USA’ Fame Teases New Show: ‘I’m A Lover Girl Through And Through’",blavity.com,2026-04-27,Entertainment,Trey Mangum,https://blavity.com/chelley-bissainthe-love-island-usa-fame-teases-new-show-details
Is Simon Guobadia Still A Multi-Millionaire? Here’s The Breakdown Of His 2026 Net Worth,"Explore Simon Guobadia's net worth, business empire, divorce from Porsha Williams and how the Nigerian-born CEO built his fortune.",blavity.com,2026-04-27,Entertainment,Joel Randell,https://blavity.com/simon-guobadia-net-worth
Millions Of Americans May Now Claim Canadian Citizenship Through Ancestry,"A subtle change in Canadian law has led millions of Americans to apply for Canadian dual citizenship after learning they can do so through ancestry. Details on the new Canadian law for dual citizenship Canadian Bill C-3 took effect Dec. 15, expanding eligibility for citizenship by descent. Previous rules limited citizenship to one generation, allowing… Continue reading Millions Of Americans May Now Claim Canadian Citizenship Through Ancestry",blavity.com,2026-04-27,Politics,Jahaura Michelle,https://blavity.com/millions-of-americans-may-now-claim-canadian-citizenship-through-ancestry
Will Insurance Cover Mounjaro For PCOS? Here’s How To Navigate The 2026 Guidelines,"Despite the benefits for insulin resistance, many insurers still won’t cover Mounjaro for PCOS. We look at the current 2026 guidelines.",blavity.com,2026-04-27,Cost &Amp; Coverage,"Dr. Diana Rangaves, PharmD",https://blavity.com/will-insurance-cover-mounjaro-for-pcos
Jimmy Jam And Terry Lewis Detail Their Journey From Meeting Through The Upward Bound Program To Vegas Residency,"Ahead of their first-ever Las Vegas residency, Jimmy Jam and Terry Lewis discuss career-defining hits, and their approach to making music.",blavity.com,2026-04-26,News,Shanique Yates,https://blavity.com/jimmy-jam-and-terry-lewis-las-vegas-residency
"Trump Sued For Racial Discrimination, Accused Of Firing 75% of Black Officials At Independent Federal Agencies",The Trump administration is accused of firing employees on the basis of race as part of his anti-DEI agenda.,blavity.com,2026-04-26,Politics,Christopher Rhodes,https://blavity.com/trump-sued-for-racial-discrimination-accused-of-firing-75-of-black-officials
Courtroom Interpreter Detained By ICE While She Was On Work Trip: ‘You Can’t Sleep Because You’re Afraid’,Longtime courtroom interpreter Meenu Batra has been detained by ICE. She has worked in the U.S. legally for 20-plus years.,blavity.com,2026-04-26,Politics,Kyra Alessandrini,https://blavity.com/courtroom-interpreter-meenu-batra-detained-by-ice
Myki Meeks Says She’s ‘From The School Of Roxxxy Andrews’ When Discussing ‘Drag Race’ Finale Lip-Sync Win,"The winner of RuPaul’s Drag Race Season 18 has been crowned, and it’s Myki Meeks! Meeks told Blavity’s Shadow and Act that finally learning she won after months of uncertainty “was everything in that moment.” “Me and Nini [Coco] were the only ones from the cast since filming [who] did not have any closure for… Continue reading Myki Meeks Says She’s ‘From The School Of Roxxxy Andrews’ When Discussing ‘Drag Race’ Finale Lip-Sync Win",blavity.com,2026-04-24,Entertainment,Monique Jones,https://blavity.com/myki-meeks-from-the-school-of-roxxxy-andrews-in-drag-race-finale
Everything To Know About Getting A Cyst Drained At Urgent Care,Don't let a painful cyst ruin your week. Find out if an urgent care can drain it on the spot and what you need to know about recovery.,blavity.com,2026-04-24,Conditions &Amp; Care,"Dr. Diana Rangaves, PharmD",https://blavity.com/can-urgent-care-drain-a-cyst
The Black Generational Habit Nobody’s Talking About Breaking,"Growing up, nobody in my family went to the doctor. Here's why I decided to break that cycle — and what my bloodwork revealed when I did.",blavity.com,2026-04-24,Mind &Amp; Body,Zayna Allen,https://blavity.com/preventative-healthcare-black-women
‘RuPaul’s Drag Race All Stars’ Season 11 Queens To Go Behind The Scenes In WOW Presents Plus’ ‘My Untucked Life’,"Nine queens from RuPaul’s Drag Race All Stars Season 11 are set to be highlighted in the new season of WOW Presents Plus’s My Untucked Life, and Blavity’s Shadow and Act has the first trailer for its exclusive debut. The nine queens showcased in the season will be Dawn, Morphine Love Dion, Mystique Summers Madison,… Continue reading ‘RuPaul’s Drag Race All Stars’ Season 11 Queens To Go Behind The Scenes In WOW Presents Plus’ ‘My Untucked Life’",blavity.com,2026-04-24,Entertainment,Trey Mangum,https://blavity.com/drag-race-all-stars-11-my-untucked-life
How BigXthaPlug Navigated The Prison System And Landed A Seven Figure Net Worth,"With a 2026 headlining tour and major festival sets at Stagecoach and BottleRock, BigXthaPlug's bank account is as loud as his baritone.",blavity.com,2026-04-24,Entertainment,TeeJay Small,https://blavity.com/bigxthaplug-net-worth
‘Beef’ Season 2 Stars On Where Their Characters End Up,"This interview contains spoilers for Beef Season 2 Oscar Isaac and Carey Mulligan break down the fates of their characters Josh and Lindsay in Beef Season 2 on Netflix. When the season ends, Lindsay and Josh are now separated and on different life paths. Years later, Lindsay has remarried finally able to have the child… Continue reading ‘Beef’ Season 2 Stars On Where Their Characters End Up",blavity.com,2026-04-24,Entertainment,Trey Mangum,https://blavity.com/beef-season-2-stars-on-where-their-characters-end-up
Nini Coco On ‘Drag Race’ Finale Lip Sync And Her Difficult Storyline: ‘Blame It On The Edit’,"Nini Coco made it all the way to the end of RuPaul’s Drag Race Season 18, ending her run as the season’s runner-up. Blavity was on hand to speak with her about her time on the show and what she made of her final lip sync and that “catty” edit. Coco said that she’s “relieved”… Continue reading Nini Coco On ‘Drag Race’ Finale Lip Sync And Her Difficult Storyline: ‘Blame It On The Edit’",blavity.com,2026-04-24,Entertainment,Monique Jones,https://blavity.com/nini-coco-on-drag-race-finale-lip-sync-and-storyline
"ABFF’s HBO Short Film Award Showcase Includes Titles Starring J. Alphonse Nicholson, Kid Cudi, Arsema Thomas And More","The American Black Film Festival (ABFF) has announced the films that are taking part in the festival’s HBO Short Film Showcase. This year is the landmark 30th edition of the festival. Taking place later in May, the fest’s short film line-up with HBO includes Spilled Milk, produced by Jordan Peele and starring J. Alphonse Nicholson… Continue reading ABFF’s HBO Short Film Award Showcase Includes Titles Starring J. Alphonse Nicholson, Kid Cudi, Arsema Thomas And More",blavity.com,2026-04-23,Entertainment,Trey Mangum,https://blavity.com/abff-hbo-short-film-award-showcase-2026
"Trump’s DOJ Charges Southern Poverty Law Center With Fraud In Shocking, Controversial Move","In a shocking and controversial move, the Justice Department announced Tuesday that it was charging a major anti-extremist organization with funneling money to the very extremists that the organization opposes. The charges against the Southern Poverty Law Center stem from payments made to confidential informants within white supremacist organizations, with defenders of the watchdog organization… Continue reading Trump’s DOJ Charges Southern Poverty Law Center With Fraud In Shocking, Controversia…",blavity.com,2026-04-23,Politics,Christopher Rhodes,https://blavity.com/trumps-doj-charges-southern-poverty-law-center-with-fraud
Everything To Know About Virginia Voters Approving New Democratic Redistricting Ahead Of 2026 Midterms,"In the latest redistricting battle, voters in Virginia have approved a measure to redraw that state’s congressional lines.",blavity.com,2026-04-23,Politics,Christopher Rhodes,https://blavity.com/virginia-voters-democratic-redistricting-approved-ahead-midterms
RFK Jr. Denies Making Yet Apologizes For Comment That Black Children Should Be Sent To Farms And ‘Reparented’,"Secretary of Health and Human Services Robert F. Kennedy Jr. appeared before a congressional panel on Wednesday in an often tense hearing that covered a variety of his past stances and current policies. One particularly heated moment came when RFK was confronted over a statement he made about Black children being “reparented,” leading to the… Continue reading RFK Jr. Denies Making Yet Apologizes For Comment That Black Children Should Be Sent To Farms And ‘Reparented’",blavity.com,2026-04-23,Politics,Christopher Rhodes,https://blavity.com/rfk-jr-denies-making-yet-apologizes-for-farm-comment-black-children
Bipartisan Bill Could Allow SNAP Recipients To Purchase Ready-To-Eat Rotisserie Chicken,Senators proposed a bill to allow SNAP recipients to buy hot rotisserie chicken with Supplemental Nutrition Assistance Program benefits.,blavity.com,2026-04-23,News,Jahaura Michelle,https://blavity.com/bill-could-allow-snap-recipients-to-purchase-rotisserie-chicken
Allyson Felix Is Building What Didn’t Exist And Reshaping the Future of Women’s Sports,Allyson Felix shares how she’s building her women’s sports firm and shaping the future for the next generation of Black women in track.,blavity.com,2026-04-23,Career &Amp; Money,Zayna Allen,https://blavity.com/allyson-felix-sports-firm
Here’s Why You Might Have Black Stains On Your Gums,"From cosmetic treatments to simple lifestyle changes, find out how to manage black stains on your gums and maintain a healthy, vibrant smile.",blavity.com,2026-04-23,Conditions &Amp; Care,"Dr. Diana Rangaves, PharmD",https://blavity.com/black-stains-on-gums
‘RuPaul’s Drag Race All Stars’ Season 11 Announces Cast Of 18 Queens For Another Bracket-Style Tourney,"We might be fresh out of RuPaul’s Drag Race Season 18, but it’s time for the all-stars to return. RuPaul’s Drag Race All Stars Season 11 is here, and the cast includes legendary favorites, queens who showed tons of promise in their seasons, and icons who deserve the title of “Mother,” like Vivacious and Kennedy… Continue reading ‘RuPaul’s Drag Race All Stars’ Season 11 Announces Cast Of 18 Queens For Another Bracket-Style Tourney",blavity.com,2026-04-23,Entertainment,Monique Jones,https://blavity.com/rupauls-drag-race-all-stars-season-11-cast-announced
"Kenya Barris On The Hero’s Journey Approach He Took To His Feature Doc Directorial Debut, ‘Jerry West: The Logo’",Kenya Barris chats with Blavity's S&A about the hero's journey approach he took to documenting the life of the late Jerry West.,blavity.com,2026-04-23,Entertainment,Shanique Yates,https://blavity.com/kenya-barris-hero-journey-approach-jerry-west-doc
From Exoneree To Elected Official: Calvin Duncan Fights GOP Push To Erase The Office He Won,Louisiana lawmakers are advancing legislation that could strip Calvin Duncan of the office he was elected to hold in Orleans Parish.,blavity.com,2026-04-22,Politics,Maya Boddie,https://blavity.com/calvin-duncan-fights-gop-push-to-erase-office-he-won
"Florida Democratic Rep. Sheila Cherfilus-McCormick Resigns From Congress Amid Ethics Probe, Possible Expulsion Vote",Rep. Sheila Cherfilus-McCormick resigned from Congress in the wake of allegations that she stole FEMA funds during the COVID pandemic.,blavity.com,2026-04-22,Politics,Christopher Rhodes,https://blavity.com/sheila-cherfilus-mccormick-resigns-from-congress
"Everyting To Know So Far About D4vd Being Officially Charged In Murder Of Teen Girl, Celeste Rivas Hernandez",Singer D4vd has been charged for the murder of a teen girl named Celeste Rivas Hernandez who went missing in 2025.,blavity.com,2026-04-22,News,Tomas Kassahun,https://blavity.com/d4vd-charged-celeste-rivas-hernandez
‘Big Mood’s Nicola Coughlan And Lydia West Unpack The Rocky Road Of Friendship Showcased Across Season 2,Big Mood creator Camilla Whitehall and leads Nicola Coughlan and Lydia West break down the dynamics of friendship displayed in Season 2.,blavity.com,2026-04-22,Entertainment,Shanique Yates,https://blavity.com/big-mood-season-two-interviews
Why Pinkydoll’s Heart Attack Scare Is A Wake-Up Call For Young Black People,"After surviving three heart attacks at age 29, internet star Pinkydoll is urging her followers to prioritize wellness.",blavity.com,2026-04-22,Conditions &Amp; Care,Joel Randell,https://blavity.com/pinkydoll-heart-attack
Is TikTok’s Mouth Taping Trend A Game-Changer Or A Health Hazard?,"We’re all chasing better rest, but is mouth taping the answer? Get the facts on the risks and benefits of the sleep trend taking over.",blavity.com,2026-04-21,Health,"Dr. Diana Rangaves, PharmD",https://blavity.com/is-mouth-taping-safe
Why A’Ja Wilson Is The Face Of The WNBA’s Million Dollar Era,"A'Ja Wilson was the WNBA's first max contract signing. The decision for her to be that first wasn't random, but it was deserved. Here's why.",blavity.com,2026-04-21,Sports,Kahlil Haywood,https://blavity.com/aja-wilson-signed-3-year-5-million-contract
Former University Of Arkansas African American Studies Director Sues School To Oppose His Firing,A professor at the University of Arkansas filed a civil rights lawsuit in federal court fighting a decision that removed him as director of the African and African American Studies program.,blavity.com,2026-04-21,Politics,Christopher Rhodes,https://blavity.com/university-of-arkansas-african-american-studies-director-sues-school
Inside The Louisiana Bill That Critics Say Would Enact Forced Labor For Unhoused People,"Advocates for unhoused individuals are warning about a new bill moving its way through the Louisiana Legislature. The bill, part of a larger trend of laws that critics say are meant to criminalize homelessness, creates a situation whereby individuals without homes could be forced to pay for treatment or be jailed and subjected to mandatory… Continue reading Inside The Louisiana Bill That Critics Say Would Enact Forced Labor For Unhoused People",blavity.com,2026-04-21,Politics,Christopher Rhodes,https://blavity.com/louisiana-bill-critics-say-would-enact-forced-labor-for-unhoused-people
